ffff880083d293c0 1037371398 C Io:2:009:2 0:1 8 >
ffff880083d29840 1037457280 S Io:2:009:2 -115:1 8 = aa0055a5 5a669969
ffff880083d29840 1037458349 C Io:2:009:2 0:1 8 >
ffff880036a01900 1038033839 S Io:2:009:2 -115:1 8 = 00f07b00 00000000
ffff880036a01900 1038035412 C Io:2:009:2 0:1 8 >
ffff880083d29240 1038036282 C Ii:2:009:1 0:1 8 = 00f07b00 00000000
ffff880036a01900 1038036386 S Ii:2:009:1 -115:1 8 <
ffff880083d296c0 1038042827 S Io:2:009:2 -115:1 8 = 00f30004 00000032
ffff880083d296c0 1038044470 C Io:2:009:2 0:1 8 >
ffff880036a01900 1038045299 C Ii:2:009:1 0:1 8 = 00f30004 00000032
ffff880083d29b40 1038045404 S Ii:2:009:1 -115:1 8 <
ffff880083d29000 1038053928 S Io:2:009:2 -115:1 8 = 00f30404 00321b5a
ffff880083d29000 1038055448 C Io:2:009:2 0:1 8 >
ffff880083d29b40 1038056301 C Ii:2:009:1 0:1 8 = 00f30404 00321b5a
ffff880083d29d80 1038056409 S Ii:2:009:1 -115:1 8 <
ffff880083d29e40 1038062878 S Io:2:009:2 -115:1 8 = 00f30804 093a3830
ffff880083d29e40 1038064413 C Io:2:009:2 0:1 8 >
ffff880083d29d80 1038065304 C Ii:2:009:1 0:1 8 = 00f30804 093a3830
ffff880083d290c0 1038065405 S Ii:2:009:1 -115:1 8 <
ffff880083d29300 1038074058 S Io:2:009:2 -115:1 8 = 00f30c04 30303030
ffff880083d29300 1038075431 C Io:2:009:2 0:1 8 >
ffff880083d290c0 1038076283 C Ii:2:009:1 0:1 8 = 00f30c04 30303030
ffff880083d29f00 1038076387 S Ii:2:009:1 -115:1 8 <
ffff880083d29c00 1038084939 S Io:2:009:2 -115:1 8 = 00f31004 30303030
ffff880083d29c00 1038086428 C Io:2:009:2 0:1 8 >
ffff880083d29f00 1038087313 C Ii:2:009:1 0:1 8 = 00f31004 30303030
ffff880036a01900 1038087434 S Ii:2:009:1 -115:1 8 <
ffff880036a010c0 1038093841 S Io:2:009:2 -115:1 8 = 00f31404 30303030
ffff880036a010c0 1038095455 C Io:2:009:2 0:1 8 >
ffff880036a01900 1038096313 C Ii:2:009:1 0:1 8 = 00f31404 30303030
ffff880083d29f00 1038096432 S Ii:2:009:1 -115:1 8 <
ffff880083d29540 1038105009 S Io:2:009:2 -115:1 8 = 00f31804 30303030
ffff880083d29540 1038106475 C Io:2:009:2 0:1 8 >
ffff880083d29f00 1038107289 C Ii:2:009:1 0:1 8 = 00f31804 30303030
ffff880083d299c0 1038107404 S Ii:2:009:1 -115:1 8 <
ffff880083d29a80 1038113840 S Io:2:009:2 -115:1 8 = 00f31c04 30303030
ffff880083d29a80 1038115424 C Io:2:009:2 0:1 8 >
ffff880083d299c0 1038116299 C Ii:2:009:1 0:1 8 = 00f31c04 30303030
ffff880083d29780 1038116412 S Ii:2:009:1 -115:1 8 <
ffff880036a01900 1038124911 S Io:2:009:2 -115:1 8 = 00f32004 30303030
ffff880036a01900 1038126433 C Io:2:009:2 0:1 8 >
ffff880083d29780 1038127311 C Ii:2:009:1 0:1 8 = 00f32004 30303030
ffff880083d29780 1038127414 S Ii:2:009:1 -115:1 8 <
ffff880083d299c0 1038133866 S Io:2:009:2 -115:1 8 = 00f32404 30303030
ffff880083d299c0 1038135420 C Io:2:009:2 0:1 8 >
ffff880083d29780 1038136291 C Ii:2:009:1 0:1 8 = 00f32404 30303030
ffff880083d29a80 1038136399 S Ii:2:009:1 -115:1 8 <
ffff880083d29f00 1038144951 S Io:2:009:2 -115:1 8 = 00f32804 30303030
ffff880083d29f00 1038146422 C Io:2:009:2 0:1 8 >
ffff880083d29a80 1038147291 C Ii:2:009:1 0:1 8 = 00f32804 30303030
ffff880036a01900 1038147407 S Ii:2:009:1 -115:1 8 <
ffff880036a010c0 1038153800 S Io:2:009:2 -115:1 8 = 00f32c04 30303030
ffff880036a010c0 1038155425 C Io:2:009:2 0:1 8 >
ffff880036a01900 1038156309 C Ii:2:009:1 0:1 8 = 00f32c04 30303030
ffff880083d29540 1038156411 S Ii:2:009:1 -115:1 8 <
ffff880083d29c00 1038164889 S Io:2:009:2 -115:1 8 = 00f33004 30303030
ffff880083d29c00 1038166429 C Io:2:009:2 0:1 8 >
ffff880083d29540 1038167298 C Ii:2:009:1 0:1 8 = 00f33004 30303030
ffff880083d290c0 1038167418 S Ii:2:009:1 -115:1 8 <
ffff880083d29300 1038173851 S Io:2:009:2 -115:1 8 = 00f33404 30303030
ffff880083d29300 1038175430 C Io:2:009:2 0:1 8 >
ffff880083d290c0 1038176292 C Ii:2:009:1 0:1 8 = 00f33404 30303030
ffff880083d29d80 1038176408 S Ii:2:009:1 -115:1 8 <
ffff880036a01900 1038184906 S Io:2:009:2 -115:1 8 = 00f33804 30303030
ffff880036a01900 1038186442 C Io:2:009:2 0:1 8 >
ffff880083d29d80 1038187297 C Ii:2:009:1 0:1 8 = 00f33804 30303030
ffff880083d29e40 1038187395 S Ii:2:009:1 -115:1 8 <
ffff880083d29b40 1038193889 S Io:2:009:2 -115:1 8 = 00f33c04 30303030
ffff880083d29b40 1038195441 C Io:2:009:2 0:1 8 >
ffff880083d29e40 1038196296 C Ii:2:009:1 0:1 8 = 00f33c04 30303030
ffff880083d29000 1038196401 S Ii:2:009:1 -115:1 8 <
ffff880083d296c0 1038204926 S Io:2:009:2 -115:1 8 = 00f17b00 00000000
ffff880083d296c0 1038206422 C Io:2:009:2 0:1 8 >
ffff880083d29000 1038258295 C Ii:2:009:1 0:1 8 = 00f17b00 00000000
ffff880083d29240 1038258439 S Ii:2:009:1 -115:1 8 <
ffff880083d29600 1038264903 S Io:2:009:2 -115:1 8 = 00f07c00 00000000
ffff880083d29600 1038266459 C Io:2:009:2 0:1 8 >
ffff880083d29240 1038267325 C Ii:2:009:1 0:1 8 = 00f07c00 00000000
ffff880036a01900 1038267421 S Ii:2:009:1 -115:1 8 <
ffff880036a010c0 1038273878 S Io:2:009:2 -115:1 8 = 00f30004 91929394
ffff880036a010c0 1038275432 C Io:2:009:2 0:1 8 >
ffff880036a01900 1038276300 C Ii:2:009:1 0:1 8 = 00f30004 91929394
ffff880083d29240 1038276409 S Ii:2:009:1 -115:1 8 <
ffff880083d29900 1038284944 S Io:2:009:2 -115:1 8 = 00f30404 95969798
ffff880083d29900 1038286451 C Io:2:009:2 0:1 8 >
ffff880083d29240 1038287304 C Ii:2:009:1 0:1 8 = 00f30404 95969798
ffff880083d29480 1038287422 S Ii:2:009:1 -115:1 8 <
ffff880083d29840 1038293877 S Io:2:009:2 -115:1 8 = 00f30804 9990ff0a
ffff880083d29840 1038295464 C Io:2:009:2 0:1 8 >
ffff880083d29480 1038296332 C Ii:2:009:1 0:1 8 = 00f30804 9990ff0a
ffff880036a01900 1038296453 S Ii:2:009:1 -115:1 8 <
ffff880036a010c0 1038302853 S Io:2:009:2 -115:1 8 = 00f30c04 ffff0e08
ffff880036a010c0 1038304465 C Io:2:009:2 0:1 8 >
ffff880036a01900 1038305317 C Ii:2:009:1 0:1 8 = 00f30c04 ffff0e08
ffff880036a01900 1038305436 S Ii:2:009:1 -115:1 8 <
ffff880036a01240 1038313939 S Io:2:009:2 -115:1 8 = 00f31004 ffffffff
ffff880036a01240 1038315461 C Io:2:009:2 0:1 8 >
ffff880036a01900 1038316326 C Ii:2:009:1 0:1 8 = 00f31004 ffffffff
ffff880083d29480 1038316432 S Ii:2:009:1 -115:1 8 <
ffff880083d29840 1038322945 S Io:2:009:2 -115:1 8 = 00f31404 ffffffff
ffff880083d29840 1038324505 C Io:2:009:2 0:1 8 >
ffff880083d29480 1038325373 C Ii:2:009:1 0:1 8 = 00f31404 ffffffff
ffff880083d293c0 1038325578 S Ii:2:009:1 -115:1 8 <
ffff880083d29480 1038334221 S Io:2:009:2 -115:1 8 = 00f31804 ffff0c0d
ffff880083d29480 1038335470 C Io:2:009:2 0:1 8 >
ffff880083d293c0 1038336347 C Ii:2:009:1 0:1 8 = 00f31804 ffff0c0d
ffff880036a01900 1038336613 S Ii:2:009:1 -115:1 8 <
ffff880036a01240 1038343031 S Io:2:009:2 -115:1 8 = 00f31c04 ffffff05
ffff880036a01240 1038344505 C Io:2:009:2 0:1 8 >
ffff880036a01900 1038345300 C Ii:2:009:1 0:1 8 = 00f31c04 ffffff05
ffff8800369003c0 1038345612 S Ii:2:009:1 -115:1 8 <
ffff880036900b40 1038354199 S Io:2:009:2 -115:1 8 = 00f32004 ffffffff
ffff880036900b40 1038355474 C Io:2:009:2 0:1 8 >
ffff8800369003c0 1038356347 C Ii:2:009:1 0:1 8 = 00f32004 ffffffff
ffff8800369003c0 1038356555 S Ii:2:009:1 -115:1 8 <
ffff880036900b40 1038365123 S Io:2:009:2 -115:1 8 = 00f32404 ffffffff
ffff880036900b40 1038366476 C Io:2:009:2 0:1 8 >
ffff8800369003c0 1038367344 C Ii:2:009:1 0:1 8 = 00f32404 ffffffff
ffff880036900780 1038367598 S Ii:2:009:1 -115:1 8 <
ffff880036900600 1038374174 S Io:2:009:2 -115:1 8 = 00f32804 09ff07ff
ffff880036900600 1038375503 C Io:2:009:2 0:1 8 >
ffff880036900780 1038376390 C Ii:2:009:1 0:1 8 = 00f32804 09ff07ff
ffff880036900c00 1038376631 S Ii:2:009:1 -115:1 8 <
ffff880036900780 1038385263 S Io:2:009:2 -115:1 8 = 00f32c04 06ffffff
ffff880036900780 1038386458 C Io:2:009:2 0:1 8 >
ffff880036900c00 1038387346 C Ii:2:009:1 0:1 8 = 00f32c04 06ffffff
ffff880036900600 1038387568 S Ii:2:009:1 -115:1 8 <
ffff8800369003c0 1038394064 S Io:2:009:2 -115:1 8 = 00f33004 1e801c1b
ffff8800369003c0 1038395508 C Io:2:009:2 0:1 8 >
ffff880036900600 1038396350 C Ii:2:009:1 0:1 8 = 00f33004 1e801c1b
ffff880131ca6f00 1038396631 S Ii:2:009:1 -115:1 8 <
ffff880131ca60c0 1038405255 S Io:2:009:2 -115:1 8 = 00f33404 1d04ffff
ffff880131ca60c0 1038406507 C Io:2:009:2 0:1 8 >
ffff880131ca6f00 1038407356 C Ii:2:009:1 0:1 8 = 00f33404 1d04ffff
ffff880131ca6000 1038407604 S Ii:2:009:1 -115:1 8 <
ffff880131ca6f00 1038414078 S Io:2:009:2 -115:1 8 = 00f33804 1f82ffff
ffff880131ca6f00 1038415519 C Io:2:009:2 0:1 8 >
ffff880131ca6000 1038416355 C Ii:2:009:1 0:1 8 = 00f33804 1f82ffff
ffff880131ca60c0 1038416555 S Ii:2:009:1 -115:1 8 <
ffff880131ca6000 1038425301 S Io:2:009:2 -115:1 8 = 00f33c04 ffffffff
ffff880131ca6000 1038426492 C Io:2:009:2 0:1 8 >
ffff880131ca60c0 1038427353 C Ii:2:009:1 0:1 8 = 00f33c04 ffffffff
ffff880036900600 1038427606 S Ii:2:009:1 -115:1 8 <
ffff880036900b40 1038434099 S Io:2:009:2 -115:1 8 = 00f17c00 00000000
ffff880036900b40 1038435514 C Io:2:009:2 0:1 8 >
ffff880036900600 1038487388 C Ii:2:009:1 0:1 8 = 00f17c00 00000000
ffff880131ca60c0 1038487654 S Ii:2:009:1 -115:1 8 <
ffff880131ca6000 1038494153 S Io:2:009:2 -115:1 8 = 00f07d00 00000000
ffff880131ca6000 1038495514 C Io:2:009:2 0:1 8 >
ffff880131ca60c0 1038496358 C Ii:2:009:1 0:1 8 = 00f07d00 00000000
ffff880036900600 1038496589 S Ii:2:009:1 -115:1 8 <
ffff880131ca60c0 1038505272 S Io:2:009:2 -115:1 8 = 00f30004 ffffffff
ffff880131ca60c0 1038506528 C Io:2:009:2 0:1 8 >
ffff880036900600 1038507376 C Ii:2:009:1 0:1 8 = 00f30004 ffffffff
ffff880036900b40 1038507619 S Ii:2:009:1 -115:1 8 <
ffff880036900600 1038514113 S Io:2:009:2 -115:1 8 = 00f30404 ffffffff
ffff880036900600 1038515529 C Io:2:009:2 0:1 8 >
ffff880036900b40 1038516333 C Ii:2:009:1 0:1 8 = 00f30404 ffffffff
ffff880036900c00 1038516624 S Ii:2:009:1 -115:1 8 <
ffff880036a01900 1038525253 S Io:2:009:2 -115:1 8 = 00f30804 ffffffff
ffff880036a01900 1038526501 C Io:2:009:2 0:1 8 >
ffff880036900c00 1038527359 C Ii:2:009:1 0:1 8 = 00f30804 ffffffff
ffff880131ca6000 1038527591 S Ii:2:009:1 -115:1 8 <
ffff880131ca6f00 1038534099 S Io:2:009:2 -115:1 8 = 00f30c04 ffffffff
ffff880131ca6f00 1038535521 C Io:2:009:2 0:1 8 >
ffff880131ca6000 1038536363 C Ii:2:009:1 0:1 8 = 00f30c04 ffffffff
ffff880131ca6000 1038536598 S Ii:2:009:1 -115:1 8 <
ffff880131ca6f00 1038545198 S Io:2:009:2 -115:1 8 = 00f31004 ffffffff
ffff880131ca6f00 1038546512 C Io:2:009:2 0:1 8 >
ffff880131ca6000 1038547390 C Ii:2:009:1 0:1 8 = 00f31004 ffffffff
ffff880036a01900 1038547739 S Ii:2:009:1 -115:1 8 <
ffff880036a01240 1038554265 S Io:2:009:2 -115:1 8 = 00f31404 0bffffff
ffff880036a01240 1038555560 C Io:2:009:2 0:1 8 >
ffff880036a01900 1038556343 C Ii:2:009:1 0:1 8 = 00f31404 0bffffff
ffff880036a01f00 1038556520 S Ii:2:009:1 -115:1 8 <
ffff880036a01540 1038565119 S Io:2:009:2 -115:1 8 = 00f31804 ffffffff
ffff880036a01540 1038566519 C Io:2:009:2 0:1 8 >
ffff880036a01f00 1038567411 C Ii:2:009:1 0:1 8 = 00f31804 ffffffff
ffff880083d29900 1038567701 S Ii:2:009:1 -115:1 8 <
ffff880083d29600 1038574164 S Io:2:009:2 -115:1 8 = 00f31c04 ffffffff
ffff880083d29600 1038575532 C Io:2:009:2 0:1 8 >
ffff880083d29900 1038576400 C Ii:2:009:1 0:1 8 = 00f31c04 ffffffff
ffff880083d29000 1038576705 S Ii:2:009:1 -115:1 8 <
ffff880083d296c0 1038585288 S Io:2:009:2 -115:1 8 = 00f32004 8183ff03
ffff880083d296c0 1038586516 C Io:2:009:2 0:1 8 >
ffff880083d29000 1038587412 C Ii:2:009:1 0:1 8 = 00f32004 8183ff03
ffff880036a01540 1038587640 S Ii:2:009:1 -115:1 8 <
ffff880036a01840 1038594139 S Io:2:009:2 -115:1 8 = 00f32404 0102ffff
ffff880036a01840 1038595527 C Io:2:009:2 0:1 8 >
ffff880036a01540 1038596344 C Ii:2:009:1 0:1 8 = 00f32404 0102ffff
ffff880036a013c0 1038596592 S Ii:2:009:1 -115:1 8 <
ffff880036a01e40 1038605165 S Io:2:009:2 -115:1 8 = 00f32804 ffffffff
ffff880036a01e40 1038606504 C Io:2:009:2 0:1 8 >
ffff880036a013c0 1038607401 C Ii:2:009:1 0:1 8 = 00f32804 ffffffff
ffff880083d29e40 1038607671 S Ii:2:009:1 -115:1 8 <
ffff880036900780 1038614181 S Io:2:009:2 -115:1 8 = 00f32c04 ffffffff
ffff880036900780 1038615513 C Io:2:009:2 0:1 8 >
ffff880083d29e40 1038616368 C Ii:2:009:1 0:1 8 = 00f32c04 ffffffff
ffff880036a01e40 1038616610 S Ii:2:009:1 -115:1 8 <
ffff880083d29b40 1038625237 S Io:2:009:2 -115:1 8 = 00f33004 ffffffff
ffff880083d29b40 1038626480 C Io:2:009:2 0:1 8 >
ffff880036a01e40 1038627337 C Ii:2:009:1 0:1 8 = 00f33004 ffffffff
ffff880036a01e40 1038627611 S Ii:2:009:1 -115:1 8 <
ffff880036a013c0 1038634060 S Io:2:009:2 -115:1 8 = 00f33404 ffffffff
ffff880036a013c0 1038635476 C Io:2:009:2 0:1 8 >
ffff880036a01e40 1038636342 C Ii:2:009:1 0:1 8 = 00f33404 ffffffff
ffff880036a01840 1038636539 S Ii:2:009:1 -115:1 8 <
ffff880083d290c0 1038645129 S Io:2:009:2 -115:1 8 = 00f33804 ff848785
ffff880083d290c0 1038646501 C Io:2:009:2 0:1 8 >
ffff880036a01840 1038647371 C Ii:2:009:1 0:1 8 = 00f33804 ff848785
ffff880083d29300 1038647670 S Ii:2:009:1 -115:1 8 <
ffff880083d29540 1038654199 S Io:2:009:2 -115:1 8 = 00f33c04 86ffffff
ffff880083d29540 1038655529 C Io:2:009:2 0:1 8 >
ffff880083d29300 1038656371 C Ii:2:009:1 0:1 8 = 00f33c04 86ffffff
ffff880083d29c00 1038656596 S Ii:2:009:1 -115:1 8 <
ffff880083d29a80 1038665164 S Io:2:009:2 -115:1 8 = 00f17d00 00000000
ffff880083d29a80 1038666505 C Io:2:009:2 0:1 8 >
ffff880083d29c00 1038718400 C Ii:2:009:1 0:1 8 = 00f17d00 00000000
ffff8800369003c0 1038718635 S Ii:2:009:1 -115:1 8 <
ffff880036900b40 1038725141 S Io:2:009:2 -115:1 8 = 00f07e00 00000000
ffff880036900b40 1038726509 C Io:2:009:2 0:1 8 >
ffff8800369003c0 1038727369 C Ii:2:009:1 0:1 8 = 00f07e00 00000000
ffff880131ca6a80 1038727602 S Ii:2:009:1 -115:1 8 <
ffff880131ca60c0 1038734065 S Io:2:009:2 -115:1 8 = 00f30004 ffffffff
ffff880131ca60c0 1038735542 C Io:2:009:2 0:1 8 >
ffff880131ca6a80 1038736360 C Ii:2:009:1 0:1 8 = 00f30004 ffffffff
ffff880083d299c0 1038736609 S Ii:2:009:1 -115:1 8 <
ffff880083d29c00 1038745190 S Io:2:009:2 -115:1 8 = 00f30404 ffffffff
ffff880083d29c00 1038746506 C Io:2:009:2 0:1 8 >
ffff880083d299c0 1038747389 C Ii:2:009:1 0:1 8 = 00f30404 ffffffff
ffff880036a01f00 1038747639 S Ii:2:009:1 -115:1 8 <
ffff880036a01900 1038754133 S Io:2:009:2 -115:1 8 = 00f30804 ffffffff
ffff880036a01900 1038755464 C Io:2:009:2 0:1 8 >
ffff880036a01f00 1038756354 C Ii:2:009:1 0:1 8 = 00f30804 ffffffff
ffff880036900600 1038756664 S Ii:2:009:1 -115:1 8 <
ffff8800369003c0 1038765250 S Io:2:009:2 -115:1 8 = 00f30c04 ffffffff
ffff8800369003c0 1038766547 C Io:2:009:2 0:1 8 >
ffff880036900600 1038767374 C Ii:2:009:1 0:1 8 = 00f30c04 ffffffff
ffff880131ca60c0 1038767631 S Ii:2:009:1 -115:1 8 <
ffff880131ca6000 1038774112 S Io:2:009:2 -115:1 8 = 00f31004 ffffffff
ffff880131ca6000 1038775547 C Io:2:009:2 0:1 8 >
ffff880131ca60c0 1038776383 C Ii:2:009:1 0:1 8 = 00f31004 ffffffff
ffff880131ca60c0 1038776630 S Ii:2:009:1 -115:1 8 <
ffff880131ca6000 1038785208 S Io:2:009:2 -115:1 8 = 00f31404 ff9a00ff
ffff880131ca6000 1038786519 C Io:2:009:2 0:1 8 >
ffff880131ca60c0 1038787380 C Ii:2:009:1 0:1 8 = 00f31404 ff9a00ff
ffff880036a01f00 1038787663 S Ii:2:009:1 -115:1 8 <
ffff880036a01240 1038794170 S Io:2:009:2 -115:1 8 = 00f31804 ffffffff
ffff880036a01240 1038795474 C Io:2:009:2 0:1 8 >
ffff880036a01f00 1038796359 C Ii:2:009:1 0:1 8 = 00f31804 ffffffff
ffff880036900b40 1038796602 S Ii:2:009:1 -115:1 8 <
ffff880036900c00 1038805176 S Io:2:009:2 -115:1 8 = 00f31c04 ffffffff
ffff880036900c00 1038806514 C Io:2:009:2 0:1 8 >
ffff880036900b40 1038807358 C Ii:2:009:1 0:1 8 = 00f31c04 ffffffff
ffff880036a01240 1038807602 S Ii:2:009:1 -115:1 8 <
ffff880036a010c0 1038816199 S Io:2:009:2 -115:1 8 = 00f32004 fffffff1
ffff880036a010c0 1038817501 C Io:2:009:2 0:1 8 >
ffff880036a01240 1038818410 C Ii:2:009:1 0:1 8 = 00f32004 fffffff1
ffff880036a01a80 1038818617 S Ii:2:009:1 -115:1 8 <
ffff880036a01240 1038825158 S Io:2:009:2 -115:1 8 = 00f32404 f2f3f4f5
ffff880036a01240 1038826529 C Io:2:009:2 0:1 8 >
ffff880036a01a80 1038827366 C Ii:2:009:1 0:1 8 = 00f32404 f2f3f4f5
ffff880036a010c0 1038827581 S Ii:2:009:1 -115:1 8 <
ffff880036a01f00 1038836192 S Io:2:009:2 -115:1 8 = 00f32804 f6f7f8f9
ffff880036a01f00 1038837501 C Io:2:009:2 0:1 8 >
ffff880036a010c0 1038838388 C Ii:2:009:1 0:1 8 = 00f32804 f6f7f8f9
ffff880036a01900 1038838629 S Ii:2:009:1 -115:1 8 <
ffff880036a01540 1038845110 S Io:2:009:2 -115:1 8 = 00f32c04 fafbfcfd
ffff880036a01540 1038846560 C Io:2:009:2 0:1 8 >
ffff880036a01900 1038847369 C Ii:2:009:1 0:1 8 = 00f32c04 fafbfcfd
ffff880036a01840 1038847576 S Ii:2:009:1 -115:1 8 <
ffff880036a01e40 1038854115 S Io:2:009:2 -115:1 8 = 00f33004 ffffffff
ffff880036a01e40 1038855559 C Io:2:009:2 0:1 8 >
ffff880036a01840 1038856390 C Ii:2:009:1 0:1 8 = 00f33004 ffffffff
ffff880036a013c0 1038856634 S Ii:2:009:1 -115:1 8 <
ffff880036a01840 1038865200 S Io:2:009:2 -115:1 8 = 00f33404 ffffffff
ffff880036a01840 1038866534 C Io:2:009:2 0:1 8 >
ffff880036a013c0 1038867365 C Ii:2:009:1 0:1 8 = 00f33404 ffffffff
ffff880036a01e40 1038867622 S Ii:2:009:1 -115:1 8 <
ffff880036a01900 1038874101 S Io:2:009:2 -115:1 8 = 00f33804 ffffffff
ffff880036a01900 1038875554 C Io:2:009:2 0:1 8 >
ffff880036a01e40 1038876391 C Ii:2:009:1 0:1 8 = 00f33804 ffffffff
ffff880036a01540 1038876600 S Ii:2:009:1 -115:1 8 <
ffff880036a010c0 1038885272 S Io:2:009:2 -115:1 8 = 00f33c04 ffffffff
ffff880036a010c0 1038886554 C Io:2:009:2 0:1 8 >
ffff880036a01540 1038887373 C Ii:2:009:1 0:1 8 = 00f33c04 ffffffff
ffff880036a01f00 1038887625 S Ii:2:009:1 -115:1 8 <
ffff880036a01a80 1038894080 S Io:2:009:2 -115:1 8 = 00f17e00 00000000
ffff880036a01a80 1038895520 C Io:2:009:2 0:1 8 >
ffff880036a01f00 1038947391 C Ii:2:009:1 0:1 8 = 00f17e00 00000000
ffff880036900780 1038947643 S Ii:2:009:1 -115:1 8 <
ffff880131ca6a80 1038956172 S Io:2:009:2 -115:1 8 = 00f07f00 00000000
ffff880131ca6a80 1038957565 C Io:2:009:2 0:1 8 >
ffff880036900780 1038958439 C Ii:2:009:1 0:1 8 = 00f07f00 00000000
ffff880036a01240 1038958681 S Ii:2:009:1 -115:1 8 <
ffff880036a01f00 1038965171 S Io:2:009:2 -115:1 8 = 00f30004 ffffffff
ffff880036a01f00 1038966569 C Io:2:009:2 0:1 8 >
ffff880036a01240 1038967402 C Ii:2:009:1 0:1 8 = 00f30004 ffffffff
ffff880036a01a80 1038967660 S Ii:2:009:1 -115:1 8 <
ffff880036a01540 1038976249 S Io:2:009:2 -115:1 8 = 00f30404 ffffffff
ffff880036a01540 1038977539 C Io:2:009:2 0:1 8 >
ffff880036a01a80 1038978411 C Ii:2:009:1 0:1 8 = 00f30404 ffffffff
ffff880036a010c0 1038978702 S Ii:2:009:1 -115:1 8 <
ffff880036a01e40 1038985156 S Io:2:009:2 -115:1 8 = 00f30804 ffffffff
ffff880036a01e40 1038986528 C Io:2:009:2 0:1 8 >
ffff880036a010c0 1038987381 C Ii:2:009:1 0:1 8 = 00f30804 ffffffff
ffff880036a01900 1038987680 S Ii:2:009:1 -115:1 8 <
ffff880036a013c0 1038994252 S Io:2:009:2 -115:1 8 = 00f30c04 ffffffff
ffff880036a013c0 1038995497 C Io:2:009:2 0:1 8 >
ffff880036a01900 1038996402 C Ii:2:009:1 0:1 8 = 00f30c04 ffffffff
ffff880083d29780 1038996675 S Ii:2:009:1 -115:1 8 <
ffff880083d29f00 1039005291 S Io:2:009:2 -115:1 8 = 00f31004 1915181a
ffff880083d29f00 1039006515 C Io:2:009:2 0:1 8 >
ffff880083d29780 1039007375 C Ii:2:009:1 0:1 8 = 00f31004 1915181a
ffff880083d29a80 1039007643 S Ii:2:009:1 -115:1 8 <
ffff880083d29300 1039014098 S Io:2:009:2 -115:1 8 = 00f31404 84868785
ffff880083d29300 1039015532 C Io:2:009:2 0:1 8 >
ffff880083d29a80 1039016404 C Ii:2:009:1 0:1 8 = 00f31404 84868785
ffff880083d29540 1039016642 S Ii:2:009:1 -115:1 8 <
ffff880083d290c0 1039025303 S Io:2:009:2 -115:1 8 = 00f31804 14171316
ffff880083d290c0 1039026513 C Io:2:009:2 0:1 8 >
ffff880083d29540 1039027371 C Ii:2:009:1 0:1 8 = 00f31804 14171316
ffff880036a01840 1039027614 S Ii:2:009:1 -115:1 8 <
ffff880036a01900 1039034083 S Io:2:009:2 -115:1 8 = 00f31c04 0f101211
ffff880036a01900 1039035517 C Io:2:009:2 0:1 8 >
ffff880036a01840 1039036426 C Ii:2:009:1 0:1 8 = 00f31c04 0f101211
ffff880036a013c0 1039036660 S Ii:2:009:1 -115:1 8 <
ffff880036a010c0 1039045199 S Io:2:009:2 -115:1 8 = 00f32004 ffffff03
ffff880036a010c0 1039046533 C Io:2:009:2 0:1 8 >
ffff880036a013c0 1039047382 C Ii:2:009:1 0:1 8 = 00f32004 ffffff03
ffff880036a01e40 1039047606 S Ii:2:009:1 -115:1 8 <
ffff880036a01a80 1039056187 S Io:2:009:2 -115:1 8 = 00f32404 01ffffff
ffff880036a01a80 1039057581 C Io:2:009:2 0:1 8 >
ffff880036a01e40 1039058444 C Ii:2:009:1 0:1 8 = 00f32404 01ffffff
ffff880036a01540 1039058759 S Ii:2:009:1 -115:1 8 <
ffff880036a01240 1039065225 S Io:2:009:2 -115:1 8 = 00f32804 ffffffff
ffff880036a01240 1039066545 C Io:2:009:2 0:1 8 >
ffff880036a01540 1039067384 C Ii:2:009:1 0:1 8 = 00f32804 ffffffff
ffff880036a01f00 1039067614 S Ii:2:009:1 -115:1 8 <
ffff880036a01540 1039076181 S Io:2:009:2 -115:1 8 = 00f32c04 ffffffff
ffff880036a01540 1039077598 C Io:2:009:2 0:1 8 >
ffff880036a01f00 1039078448 C Ii:2:009:1 0:1 8 = 00f32c04 ffffffff
ffff880036a01240 1039078678 S Ii:2:009:1 -115:1 8 <
ffff880036a01e40 1039085182 S Io:2:009:2 -115:1 8 = 00f33004 ffffffff
ffff880036a01e40 1039086571 C Io:2:009:2 0:1 8 >
ffff880036a01240 1039087385 C Ii:2:009:1 0:1 8 = 00f33004 ffffffff
ffff880036a01a80 1039087674 S Ii:2:009:1 -115:1 8 <
ffff880036a013c0 1039096215 S Io:2:009:2 -115:1 8 = 00f33404 ffffffff
ffff880036a013c0 1039097557 C Io:2:009:2 0:1 8 >
ffff880036a01a80 1039098453 C Ii:2:009:1 0:1 8 = 00f33404 ffffffff
ffff880036a010c0 1039098706 S Ii:2:009:1 -115:1 8 <
ffff880036a01840 1039105154 S Io:2:009:2 -115:1 8 = 00f33804 ffffffff
ffff880036a01840 1039106540 C Io:2:009:2 0:1 8 >
ffff880036a010c0 1039107378 C Ii:2:009:1 0:1 8 = 00f33804 ffffffff
ffff880036a01900 1039107658 S Ii:2:009:1 -115:1 8 <
ffff880036a010c0 1039114173 S Io:2:009:2 -115:1 8 = 00f33c04 ffffffff
ffff880036a010c0 1039115563 C Io:2:009:2 0:1 8 >
ffff880036a01900 1039116414 C Ii:2:009:1 0:1 8 = 00f33c04 ffffffff
ffff880036a01840 1039116636 S Ii:2:009:1 -115:1 8 <
ffff880036a01a80 1039125294 S Io:2:009:2 -115:1 8 = 00f17f00 00000000
ffff880036a01a80 1039126545 C Io:2:009:2 0:1 8 >
ffff880036a01840 1039178460 C Ii:2:009:1 0:1 8 = 00f17f00 00000000
ffff880036a013c0 1039178768 S Ii:2:009:1 -115:1 8 <
ffff880036a01240 1039185307 S Io:2:009:2 -115:1 8 = 00f07b00 00000000
ffff880036a01240 1039186582 C Io:2:009:2 0:1 8 >
ffff880036a013c0 1039187398 C Ii:2:009:1 0:1 8 = 00f07b00 00000000
ffff880036a01e40 1039187632 S Ii:2:009:1 -115:1 8 <
ffff880036900b40 1039196230 S Io:2:009:2 -115:1 8 = 00f20004 00000000
ffff880036900b40 1039197554 C Io:2:009:2 0:1 8 >
ffff880036a01e40 1039198462 C Ii:2:009:1 0:1 8 = 00f20004 00000032
ffff880036a01f00 1039198729 S Ii:2:009:1 -115:1 8 <
ffff880036a01540 1039205217 S Io:2:009:2 -115:1 8 = 00f20404 00000000
ffff880036a01540 1039206556 C Io:2:009:2 0:1 8 >
ffff880036a01f00 1039207388 C Ii:2:009:1 0:1 8 = 00f20404 00321b5a
ffff880036a01f00 1039207633 S Ii:2:009:1 -115:1 8 <
ffff880036a01540 1039216191 S Io:2:009:2 -115:1 8 = 00f20804 00000000
ffff880036a01540 1039217548 C Io:2:009:2 0:1 8 >
ffff880036a01f00 1039218460 C Ii:2:009:1 0:1 8 = 00f20804 093a3830
ffff880036a01e40 1039218693 S Ii:2:009:1 -115:1 8 <
ffff880036900600 1039333211 S Io:2:009:2 -115:1 8 = aa0055a5 5a669969
ffff880036900600 1039334551 C Io:2:009:2 0:1 8 >
ffff880036a01840 1039428282 S Io:2:009:2 -115:1 8 = aa0055a5 5a669969
ffff880036a01840 1039429608 C Io:2:009:2 0:1 8 >
ffff8800369003c0 1039543345 S Io:2:009:2 -115:1 8 = aa0055a5 5a669969
