ffff880030832480 2824130089 S Io:2:005:2 -115:1 8 = aa0055a5 5a669969
ffff880030832480 2824131218 C Io:2:005:2 0:1 8 >
ffff880030832a80 2824217108 S Io:2:005:2 -115:1 8 = aa0055a5 5a669969
ffff880030832a80 2824218254 C Io:2:005:2 0:1 8 >
ffff88012ec09000 2824332100 S Io:2:005:2 -115:1 8 = aa0055a5 5a669969
ffff88012ec09000 2824333255 C Io:2:005:2 0:1 8 >
ffff880113ab6300 2824419078 S Io:2:005:2 -115:1 8 = aa0055a5 5a669969
ffff880113ab6300 2824420245 C Io:2:005:2 0:1 8 >
ffff880030832000 2824533956 S Io:2:005:2 -115:1 8 = aa0055a5 5a669969
ffff880030832000 2824535280 C Io:2:005:2 0:1 8 >
ffff880113ab6300 2824621001 S Io:2:005:2 -115:1 8 = aa0055a5 5a669969
ffff880113ab6300 2824622279 C Io:2:005:2 0:1 8 >
ffff880036a77300 2824716028 S Io:2:005:2 -115:1 8 = aa0055a5 5a669969
ffff880036a77300 2824717245 C Io:2:005:2 0:1 8 >
ffff880036a77300 2824830900 S Io:2:005:2 -115:1 8 = aa0055a5 5a669969
ffff880036a77300 2824832222 C Io:2:005:2 0:1 8 >
ffff880030832000 2824917666 S Io:2:005:2 -115:1 8 = aa0055a5 5a669969
ffff880030832000 2824919265 C Io:2:005:2 0:1 8 >
ffff880036a77780 2825032817 S Io:2:005:2 -115:1 8 = aa0055a5 5a669969
ffff880036a77780 2825034251 C Io:2:005:2 0:1 8 >
ffff880030832b40 2825119700 S Io:2:005:2 -115:1 8 = aa0055a5 5a669969
ffff880030832b40 2825121235 C Io:2:005:2 0:1 8 >
ffff88012ec09540 2825234907 S Io:2:005:2 -115:1 8 = aa0055a5 5a669969
ffff88012ec09540 2825236243 C Io:2:005:2 0:1 8 >
ffff880113ab6900 2825321637 S Io:2:005:2 -115:1 8 = aa0055a5 5a669969
ffff880113ab6900 2825323245 C Io:2:005:2 0:1 8 >
ffff880030832600 2825416846 S Io:2:005:2 -115:1 8 = aa0055a5 5a669969
ffff880030832600 2825418277 C Io:2:005:2 0:1 8 >
ffff880113ab6900 2825531884 S Io:2:005:2 -115:1 8 = aa0055a5 5a669969
ffff880113ab6900 2825533228 C Io:2:005:2 0:1 8 >
ffff880030832600 2825618791 S Io:2:005:2 -115:1 8 = aa0055a5 5a669969
ffff880030832600 2825620275 C Io:2:005:2 0:1 8 >
ffff880030832240 2825733839 S Io:2:005:2 -115:1 8 = aa0055a5 5a669969
ffff880030832240 2825735278 C Io:2:005:2 0:1 8 >
ffff880030832840 2825820979 S Io:2:005:2 -115:1 8 = aa0055a5 5a669969
ffff880030832840 2825822242 C Io:2:005:2 0:1 8 >
ffff880030832780 2825935913 S Io:2:005:2 -115:1 8 = aa0055a5 5a669969
ffff880030832780 2825937243 C Io:2:005:2 0:1 8 >
ffff880030832e40 2826022866 S Io:2:005:2 -115:1 8 = aa0055a5 5a669969
ffff880030832e40 2826024275 C Io:2:005:2 0:1 8 >
ffff880030832e40 2826117990 S Io:2:005:2 -115:1 8 = aa0055a5 5a669969
ffff880030832e40 2826119255 C Io:2:005:2 0:1 8 >
ffff880113ab66c0 2826232880 S Io:2:005:2 -115:1 8 = aa0055a5 5a669969
ffff880113ab66c0 2826234191 C Io:2:005:2 0:1 8 >
ffff880113ab6f00 2826249987 S Io:2:005:2 -115:1 8 = 00a20b00 00000000
ffff880113ab6f00 2826251221 C Io:2:005:2 0:1 8 >
ffff8800308320c0 2826252107 C Ii:2:005:1 0:1 8 = 00a20b00 00000000
ffff880030832840 2826252391 S Ii:2:005:1 -115:1 8 <
ffff880113ab6f00 2826269275 S Io:2:005:2 -115:1 8 = 00a30000 00000000
ffff880113ab6f00 2826270191 C Io:2:005:2 0:1 8 >
ffff880030832840 2826271088 C Ii:2:005:1 0:1 8 = 00a30000 00000000
ffff880113ab6f00 2826271238 S Ii:2:005:1 -115:1 8 <
ffff880030832780 2826426335 S Io:2:005:2 -115:1 8 = aa0055a5 5a669969
ffff880030832780 2826427223 C Io:2:005:2 0:1 8 >
ffff880030832600 2826520942 S Io:2:005:2 -115:1 8 = aa0055a5 5a669969
ffff880030832600 2826522243 C Io:2:005:2 0:1 8 >
ffff880030832600 2826635850 S Io:2:005:2 -115:1 8 = aa0055a5 5a669969
ffff880030832600 2826637256 C Io:2:005:2 0:1 8 >
ffff880113ab6780 2826722608 S Io:2:005:2 -115:1 8 = aa0055a5 5a669969
ffff880113ab6780 2826724247 C Io:2:005:2 0:1 8 >
ffff880030832cc0 2826837962 S Io:2:005:2 -115:1 8 = aa0055a5 5a669969
ffff880030832cc0 2826839242 C Io:2:005:2 0:1 8 >
ffff8800308323c0 2826924716 S Io:2:005:2 -115:1 8 = aa0055a5 5a669969
ffff8800308323c0 2826926224 C Io:2:005:2 0:1 8 >
ffff880030832b40 2827019951 S Io:2:005:2 -115:1 8 = aa0055a5 5a669969
ffff880030832b40 2827021267 C Io:2:005:2 0:1 8 >
ffff88012ec09540 2827090762 S Io:2:005:2 -115:1 8 = 00a20b00 00000000
ffff88012ec09540 2827092273 C Io:2:005:2 0:1 8 >
ffff880113ab6f00 2827093109 C Ii:2:005:1 0:1 8 = 00a20b00 00000000
ffff88012ec09180 2827093368 S Ii:2:005:1 -115:1 8 <
ffff880113ab6c00 2827139114 S Io:2:005:2 -115:1 8 = 00a30000 00000000
ffff880113ab6c00 2827140189 C Io:2:005:2 0:1 8 >
ffff88012ec09180 2827141084 C Ii:2:005:1 0:1 8 = 00a30000 00000000
ffff880113ab6900 2827141316 S Ii:2:005:1 -115:1 8 <
ffff880036a77300 2827336421 S Io:2:005:2 -115:1 8 = aa0055a5 5a669969
ffff880036a77300 2827337204 C Io:2:005:2 0:1 8 >
ffff880030832a80 2827423192 S Io:2:005:2 -115:1 8 = aa0055a5 5a669969
ffff880030832a80 2827424214 C Io:2:005:2 0:1 8 >
ffff88012ec09000 2827538060 S Io:2:005:2 -115:1 8 = aa0055a5 5a669969
ffff88012ec09000 2827539244 C Io:2:005:2 0:1 8 >
ffff88012ec09b40 2827625132 S Io:2:005:2 -115:1 8 = aa0055a5 5a669969
ffff88012ec09b40 2827626244 C Io:2:005:2 0:1 8 >
ffff880030832000 2827720021 S Io:2:005:2 -115:1 8 = aa0055a5 5a669969
ffff880030832000 2827721272 C Io:2:005:2 0:1 8 >
ffff880036a77780 2827834569 S Io:2:005:2 -115:1 8 = aa0055a5 5a669969
ffff880036a77780 2827836202 C Io:2:005:2 0:1 8 >
ffff880036a77780 2827921213 S Io:2:005:2 -115:1 8 = aa0055a5 5a669969
ffff880036a77780 2827922190 C Io:2:005:2 0:1 8 >
ffff880113ab6600 2827942310 S Io:2:005:2 -115:1 8 = 00a20b00 00000000
ffff880113ab6600 2827943188 C Io:2:005:2 0:1 8 >
ffff880113ab6900 2827944058 C Ii:2:005:1 0:1 8 = 00a20b00 00000000
ffff880113ab6900 2827944211 S Ii:2:005:1 -115:1 8 <
ffff880036a77780 2827989798 S Io:2:005:2 -115:1 8 = 00a30000 00000000
ffff880036a77780 2827991230 C Io:2:005:2 0:1 8 >
ffff880113ab6900 2827992057 C Ii:2:005:1 0:1 8 = 00a30000 00000000
ffff880036a77780 2827992171 S Ii:2:005:1 -115:1 8 <
ffff880036a77300 2828126506 S Io:2:005:2 -115:1 8 = aa0055a5 5a669969
ffff880036a77300 2828127211 C Io:2:005:2 0:1 8 >
ffff880036a77300 2828240434 S Io:2:005:2 -115:1 8 = aa0055a5 5a669969
ffff880036a77300 2828241219 C Io:2:005:2 0:1 8 >
ffff880036a77300 2828326319 S Io:2:005:2 -115:1 8 = aa0055a5 5a669969
ffff880036a77300 2828327186 C Io:2:005:2 0:1 8 >
ffff880036a77300 2828420715 S Io:2:005:2 -115:1 8 = aa0055a5 5a669969
ffff880036a77300 2828422205 C Io:2:005:2 0:1 8 >
ffff880113ab6f00 2828535720 S Io:2:005:2 -115:1 8 = aa0055a5 5a669969
ffff880113ab6f00 2828537273 C Io:2:005:2 0:1 8 >
ffff8800308323c0 2828623004 S Io:2:005:2 -115:1 8 = aa0055a5 5a669969
ffff8800308323c0 2828624235 C Io:2:005:2 0:1 8 >
ffff88012ec09540 2828738004 S Io:2:005:2 -115:1 8 = aa0055a5 5a669969
ffff88012ec09540 2828739234 C Io:2:005:2 0:1 8 >
ffff88012ec09900 2828824923 S Io:2:005:2 -115:1 8 = aa0055a5 5a669969
ffff88012ec09900 2828826184 C Io:2:005:2 0:1 8 >
ffff88012ec09840 2828940103 S Io:2:005:2 -115:1 8 = aa0055a5 5a669969
ffff88012ec09840 2828941191 C Io:2:005:2 0:1 8 >
ffff880113ab63c0 2829026587 S Io:2:005:2 -115:1 8 = aa0055a5 5a669969
ffff880113ab63c0 2829028237 C Io:2:005:2 0:1 8 >
ffff880113ab6780 2829121707 S Io:2:005:2 -115:1 8 = aa0055a5 5a669969
ffff880113ab6780 2829123245 C Io:2:005:2 0:1 8 >
ffff880113ab6780 2829237165 S Io:2:005:2 -115:1 8 = aa0055a5 5a669969
ffff880113ab6780 2829238203 C Io:2:005:2 0:1 8 >
ffff880113ab63c0 2829323651 S Io:2:005:2 -115:1 8 = aa0055a5 5a669969
ffff880113ab63c0 2829325231 C Io:2:005:2 0:1 8 >
ffff880030832300 2829438992 S Io:2:005:2 -115:1 8 = aa0055a5 5a669969
ffff880030832300 2829440235 C Io:2:005:2 0:1 8 >
ffff880030832240 2829525517 S Io:2:005:2 -115:1 8 = aa0055a5 5a669969
ffff880030832240 2829526236 C Io:2:005:2 0:1 8 >
ffff880030832780 2829640108 S Io:2:005:2 -115:1 8 = aa0055a5 5a669969
ffff880030832780 2829641212 C Io:2:005:2 0:1 8 >
ffff880030832840 2829726777 S Io:2:005:2 -115:1 8 = aa0055a5 5a669969
ffff880030832840 2829728266 C Io:2:005:2 0:1 8 >
ffff880113ab66c0 2829842085 S Io:2:005:2 -115:1 8 = aa0055a5 5a669969
ffff880113ab66c0 2829843200 C Io:2:005:2 0:1 8 >
ffff880113ab6f00 2829928691 S Io:2:005:2 -115:1 8 = aa0055a5 5a669969
ffff880113ab6f00 2829930269 C Io:2:005:2 0:1 8 >
ffff880036a630c0 2830023964 S Io:2:005:2 -115:1 8 = aa0055a5 5a669969
ffff880036a630c0 2830025232 C Io:2:005:2 0:1 8 >
ffff880030832e40 2830138984 S Io:2:005:2 -115:1 8 = aa0055a5 5a669969
ffff880030832e40 2830140235 C Io:2:005:2 0:1 8 >
ffff880030832840 2830225776 S Io:2:005:2 -115:1 8 = aa0055a5 5a669969
ffff880030832840 2830227215 C Io:2:005:2 0:1 8 >
ffff880113ab6f00 2830340940 S Io:2:005:2 -115:1 8 = aa0055a5 5a669969
ffff880113ab6f00 2830342210 C Io:2:005:2 0:1 8 >
ffff880113ab6900 2830427744 S Io:2:005:2 -115:1 8 = aa0055a5 5a669969
ffff880113ab6900 2830429266 C Io:2:005:2 0:1 8 >
ffff880030832780 2830542887 S Io:2:005:2 -115:1 8 = aa0055a5 5a669969
ffff880030832780 2830544212 C Io:2:005:2 0:1 8 >
ffff880113ab6c00 2830629539 S Io:2:005:2 -115:1 8 = aa0055a5 5a669969
ffff880113ab6c00 2830631241 C Io:2:005:2 0:1 8 >
ffff880030832240 2830724784 S Io:2:005:2 -115:1 8 = aa0055a5 5a669969
ffff880030832240 2830726252 C Io:2:005:2 0:1 8 >
ffff880113ab6300 2830840027 S Io:2:005:2 -115:1 8 = aa0055a5 5a669969
ffff880113ab6300 2830841199 C Io:2:005:2 0:1 8 >
ffff880030832300 2830926576 S Io:2:005:2 -115:1 8 = aa0055a5 5a669969
ffff880030832300 2830928263 C Io:2:005:2 0:1 8 >
ffff880113ab63c0 2831041932 S Io:2:005:2 -115:1 8 = aa0055a5 5a669969
ffff880113ab63c0 2831043184 C Io:2:005:2 0:1 8 >
ffff880113ab6780 2831128664 S Io:2:005:2 -115:1 8 = aa0055a5 5a669969
ffff880113ab6780 2831130232 C Io:2:005:2 0:1 8 >
ffff880113ab6780 2831244001 S Io:2:005:2 -115:1 8 = aa0055a5 5a669969
ffff880113ab6780 2831245199 C Io:2:005:2 0:1 8 >
ffff880113ab63c0 2831330698 S Io:2:005:2 -115:1 8 = aa0055a5 5a669969
ffff880113ab63c0 2831332190 C Io:2:005:2 0:1 8 >
ffff880036a630c0 2831425861 S Io:2:005:2 -115:1 8 = aa0055a5 5a669969
ffff880036a630c0 2831427267 C Io:2:005:2 0:1 8 >
ffff880036a63cc0 2831541202 S Io:2:005:2 -115:1 8 = aa0055a5 5a669969
ffff880036a63cc0 2831542229 C Io:2:005:2 0:1 8 >
ffff880036a63cc0 2831627912 S Io:2:005:2 -115:1 8 = aa0055a5 5a669969
ffff880036a63cc0 2831629209 C Io:2:005:2 0:1 8 >
ffff880036a630c0 2831743008 S Io:2:005:2 -115:1 8 = aa0055a5 5a669969
ffff880036a630c0 2831744265 C Io:2:005:2 0:1 8 >
ffff880036a63b40 2831829916 S Io:2:005:2 -115:1 8 = aa0055a5 5a669969
ffff880036a63b40 2831831257 C Io:2:005:2 0:1 8 >
ffff880036a636c0 2831945061 S Io:2:005:2 -115:1 8 = aa0055a5 5a669969
ffff880036a636c0 2831946183 C Io:2:005:2 0:1 8 >
ffff880036a63e40 2832031746 S Io:2:005:2 -115:1 8 = aa0055a5 5a669969
ffff880036a63e40 2832033229 C Io:2:005:2 0:1 8 >
ffff880030832a80 2832126958 S Io:2:005:2 -115:1 8 = aa0055a5 5a669969
ffff880030832a80 2832128198 C Io:2:005:2 0:1 8 >
ffff880113ab6600 2832241857 S Io:2:005:2 -115:1 8 = aa0055a5 5a669969
ffff880113ab6600 2832243227 C Io:2:005:2 0:1 8 >
ffff880030832600 2832328944 S Io:2:005:2 -115:1 8 = aa0055a5 5a669969
ffff880030832600 2832330236 C Io:2:005:2 0:1 8 >
ffff8800308323c0 2832444006 S Io:2:005:2 -115:1 8 = aa0055a5 5a669969
ffff8800308323c0 2832445228 C Io:2:005:2 0:1 8 >
ffff88012ec09f00 2832530533 S Io:2:005:2 -115:1 8 = aa0055a5 5a669969
ffff88012ec09f00 2832532262 C Io:2:005:2 0:1 8 >
ffff880030832300 2832645919 S Io:2:005:2 -115:1 8 = aa0055a5 5a669969
ffff880030832300 2832647198 C Io:2:005:2 0:1 8 >
ffff88012ec09d80 2832732751 S Io:2:005:2 -115:1 8 = aa0055a5 5a669969
ffff88012ec09d80 2832734259 C Io:2:005:2 0:1 8 >
ffff880036a63e40 2832827991 S Io:2:005:2 -115:1 8 = aa0055a5 5a669969
ffff880036a63e40 2832829254 C Io:2:005:2 0:1 8 >
ffff880036a636c0 2832943097 S Io:2:005:2 -115:1 8 = aa0055a5 5a669969
ffff880036a636c0 2832944177 C Io:2:005:2 0:1 8 >
ffff880113ab6d80 2833029488 S Io:2:005:2 -115:1 8 = aa0055a5 5a669969
ffff880113ab6d80 2833030226 C Io:2:005:2 0:1 8 >
ffff880113ab63c0 2833143831 S Io:2:005:2 -115:1 8 = aa0055a5 5a669969
ffff880113ab63c0 2833145227 C Io:2:005:2 0:1 8 >
ffff880030832840 2833230800 S Io:2:005:2 -115:1 8 = aa0055a5 5a669969
ffff880030832840 2833232191 C Io:2:005:2 0:1 8 >
ffff880030832840 2833345845 S Io:2:005:2 -115:1 8 = aa0055a5 5a669969
ffff880030832840 2833347227 C Io:2:005:2 0:1 8 >
ffff880113ab63c0 2833432664 S Io:2:005:2 -115:1 8 = aa0055a5 5a669969
ffff880113ab63c0 2833434253 C Io:2:005:2 0:1 8 >
ffff88012ec09240 2833547763 S Io:2:005:2 -115:1 8 = aa0055a5 5a669969
ffff88012ec09240 2833549259 C Io:2:005:2 0:1 8 >
ffff88012ec09f00 2833634899 S Io:2:005:2 -115:1 8 = aa0055a5 5a669969
ffff88012ec09f00 2833636243 C Io:2:005:2 0:1 8 >
ffff88012ec096c0 2833729845 S Io:2:005:2 -115:1 8 = aa0055a5 5a669969
ffff88012ec096c0 2833731180 C Io:2:005:2 0:1 8 >
ffff88012ec09000 2833846110 S Io:2:005:2 -115:1 8 = aa0055a5 5a669969
ffff88012ec09000 2833847203 C Io:2:005:2 0:1 8 >
ffff88012ec09a80 2833932687 S Io:2:005:2 -115:1 8 = aa0055a5 5a669969
ffff88012ec09a80 2833934223 C Io:2:005:2 0:1 8 >
ffff88012ec09840 2834047986 S Io:2:005:2 -115:1 8 = aa0055a5 5a669969
ffff88012ec09840 2834049232 C Io:2:005:2 0:1 8 >
ffff88012ec09840 2834134803 S Io:2:005:2 -115:1 8 = aa0055a5 5a669969
ffff88012ec09840 2834136224 C Io:2:005:2 0:1 8 >
ffff880036a630c0 2834229834 S Io:2:005:2 -115:1 8 = aa0055a5 5a669969
ffff880036a630c0 2834231258 C Io:2:005:2 0:1 8 >
ffff880030832840 2834344851 S Io:2:005:2 -115:1 8 = aa0055a5 5a669969
ffff880030832840 2834346224 C Io:2:005:2 0:1 8 >
ffff880030832300 2834431578 S Io:2:005:2 -115:1 8 = aa0055a5 5a669969
ffff880030832300 2834433255 C Io:2:005:2 0:1 8 >
ffff880036a636c0 2834546887 S Io:2:005:2 -115:1 8 = aa0055a5 5a669969
ffff880036a636c0 2834548223 C Io:2:005:2 0:1 8 >
ffff880036a63e40 2834633807 S Io:2:005:2 -115:1 8 = aa0055a5 5a669969
ffff880036a63e40 2834635259 C Io:2:005:2 0:1 8 >
ffff880036a63e40 2834688533 S Io:2:005:2 -115:1 8 = 00a28200 00000000
ffff880036a63e40 2834690253 C Io:2:005:2 0:1 8 >
ffff880036a77780 2834691124 C Ii:2:005:1 0:1 8 = 00a28200 00000000
ffff880036a636c0 2834691388 S Ii:2:005:1 -115:1 8 <
ffff880036a630c0 2834745225 S Io:2:005:2 -115:1 8 = 00a30000 00000000
ffff880036a630c0 2834746237 C Io:2:005:2 0:1 8 >
ffff880036a636c0 2834747091 C Ii:2:005:1 0:1 8 = 00a30000 00000000
ffff880036a63780 2834747323 S Ii:2:005:1 -115:1 8 <
ffff880113ab6600 2834942129 S Io:2:005:2 -115:1 8 = aa0055a5 5a669969
ffff880113ab6600 2834943219 C Io:2:005:2 0:1 8 >
ffff880113ab66c0 2835036709 S Io:2:005:2 -115:1 8 = aa0055a5 5a669969
ffff880113ab66c0 2835038256 C Io:2:005:2 0:1 8 >
ffff880030832240 2835132004 S Io:2:005:2 -115:1 8 = aa0055a5 5a669969
ffff880030832240 2835133193 C Io:2:005:2 0:1 8 >
ffff88012ec09840 2835246766 S Io:2:005:2 -115:1 8 = aa0055a5 5a669969
ffff88012ec09840 2835248256 C Io:2:005:2 0:1 8 >
ffff880036a77300 2835333945 S Io:2:005:2 -115:1 8 = aa0055a5 5a669969
ffff880036a77300 2835335219 C Io:2:005:2 0:1 8 >
ffff880036a77780 2835448947 S Io:2:005:2 -115:1 8 = aa0055a5 5a669969
ffff880036a77780 2835450263 C Io:2:005:2 0:1 8 >
ffff880030832a80 2835535590 S Io:2:005:2 -115:1 8 = aa0055a5 5a669969
ffff880030832a80 2835537222 C Io:2:005:2 0:1 8 >
ffff880113ab63c0 2835651018 S Io:2:005:2 -115:1 8 = aa0055a5 5a669969
ffff880113ab63c0 2835652245 C Io:2:005:2 0:1 8 >
ffff880036a77780 2835737910 S Io:2:005:2 -115:1 8 = aa0055a5 5a669969
ffff880036a77780 2835739248 C Io:2:005:2 0:1 8 >
ffff880036a77300 2835833040 S Io:2:005:2 -115:1 8 = aa0055a5 5a669969
ffff880036a77300 2835834219 C Io:2:005:2 0:1 8 >
ffff880036a77540 2835948040 S Io:2:005:2 -115:1 8 = aa0055a5 5a669969
ffff880036a77540 2835949213 C Io:2:005:2 0:1 8 >
ffff880113ab6900 2836034752 S Io:2:005:2 -115:1 8 = aa0055a5 5a669969
ffff880113ab6900 2836036262 C Io:2:005:2 0:1 8 >
ffff880113ab6900 2836149870 S Io:2:005:2 -115:1 8 = aa0055a5 5a669969
ffff880113ab6900 2836151245 C Io:2:005:2 0:1 8 >
ffff880036a77540 2836236952 S Io:2:005:2 -115:1 8 = aa0055a5 5a669969
ffff880036a77540 2836238257 C Io:2:005:2 0:1 8 >
ffff880036a77300 2836352226 S Io:2:005:2 -115:1 8 = aa0055a5 5a669969
ffff880036a77300 2836353219 C Io:2:005:2 0:1 8 >
ffff880036a77780 2836439073 S Io:2:005:2 -115:1 8 = aa0055a5 5a669969
ffff880036a77780 2836440214 C Io:2:005:2 0:1 8 >
ffff880036a77780 2836533889 S Io:2:005:2 -115:1 8 = aa0055a5 5a669969
ffff880036a77780 2836535219 C Io:2:005:2 0:1 8 >
ffff880036a77300 2836649071 S Io:2:005:2 -115:1 8 = aa0055a5 5a669969
ffff880036a77300 2836650169 C Io:2:005:2 0:1 8 >
ffff880113ab63c0 2836735760 S Io:2:005:2 -115:1 8 = aa0055a5 5a669969
ffff880113ab63c0 2836737243 C Io:2:005:2 0:1 8 >
ffff880113ab6300 2836851198 S Io:2:005:2 -115:1 8 = aa0055a5 5a669969
ffff880113ab6300 2836852187 C Io:2:005:2 0:1 8 >
ffff880036a77540 2836937967 S Io:2:005:2 -115:1 8 = aa0055a5 5a669969
ffff880036a77540 2836939249 C Io:2:005:2 0:1 8 >
ffff880036a77540 2837033032 S Io:2:005:2 -115:1 8 = aa0055a5 5a669969
ffff880036a77540 2837034249 C Io:2:005:2 0:1 8 >
ffff880036a77300 2837148202 S Io:2:005:2 -115:1 8 = aa0055a5 5a669969
ffff880036a77300 2837149216 C Io:2:005:2 0:1 8 >
ffff880036a77780 2837235037 S Io:2:005:2 -115:1 8 = aa0055a5 5a669969
ffff880036a77780 2837236214 C Io:2:005:2 0:1 8 >
ffff880036a77780 2837313857 S Io:2:005:2 -115:1 8 = 00a21c00 00000000
ffff880036a77780 2837315254 C Io:2:005:2 0:1 8 >
ffff880036a63780 2837316086 C Ii:2:005:1 0:1 8 = 00a21c00 00000000
ffff880036a77300 2837316316 S Ii:2:005:1 -115:1 8 <
ffff880036a77540 2837341647 S Io:2:005:2 -115:1 8 = 00a30000 00000000
ffff880036a77540 2837343218 C Io:2:005:2 0:1 8 >
ffff880036a77300 2837344086 C Ii:2:005:1 0:1 8 = 00a30000 00000000
ffff880036a77780 2837344318 S Ii:2:005:1 -115:1 8 <
ffff880036a77300 2837540142 S Io:2:005:2 -115:1 8 = aa0055a5 5a669969
ffff880036a77300 2837541191 C Io:2:005:2 0:1 8 >
ffff880036a77540 2837635046 S Io:2:005:2 -115:1 8 = aa0055a5 5a669969
ffff880036a77540 2837636229 C Io:2:005:2 0:1 8 >
ffff880036a77540 2837749973 S Io:2:005:2 -115:1 8 = aa0055a5 5a669969
ffff880036a77540 2837751189 C Io:2:005:2 0:1 8 >
ffff880036a77300 2837836687 S Io:2:005:2 -115:1 8 = aa0055a5 5a669969
ffff880036a77300 2837838252 C Io:2:005:2 0:1 8 >
ffff880030832b40 2837952042 S Io:2:005:2 -115:1 8 = aa0055a5 5a669969
ffff880030832b40 2837953199 C Io:2:005:2 0:1 8 >
ffff880113ab6780 2838038864 S Io:2:005:2 -115:1 8 = aa0055a5 5a669969
ffff880113ab6780 2838040254 C Io:2:005:2 0:1 8 >
ffff880030832cc0 2838154298 S Io:2:005:2 -115:1 8 = aa0055a5 5a669969
ffff880030832cc0 2838155214 C Io:2:005:2 0:1 8 >
ffff880030832000 2838241033 S Io:2:005:2 -115:1 8 = aa0055a5 5a669969
ffff880030832000 2838242193 C Io:2:005:2 0:1 8 >
ffff880030832840 2838335744 S Io:2:005:2 -115:1 8 = aa0055a5 5a669969
ffff880030832840 2838337211 C Io:2:005:2 0:1 8 >
ffff880113ab66c0 2838451047 S Io:2:005:2 -115:1 8 = aa0055a5 5a669969
ffff880113ab66c0 2838452216 C Io:2:005:2 0:1 8 >
ffff880113ab66c0 2838537292 S Io:2:005:2 -115:1 8 = aa0055a5 5a669969
ffff880113ab66c0 2838538223 C Io:2:005:2 0:1 8 >
ffff880113ab6600 2838652029 S Io:2:005:2 -115:1 8 = aa0055a5 5a669969
ffff880113ab6600 2838653195 C Io:2:005:2 0:1 8 >
ffff880036a77540 2838738822 S Io:2:005:2 -115:1 8 = aa0055a5 5a669969
ffff880036a77540 2838740244 C Io:2:005:2 0:1 8 >
ffff880036a77540 2838854153 S Io:2:005:2 -115:1 8 = aa0055a5 5a669969
ffff880036a77540 2838855214 C Io:2:005:2 0:1 8 >
